,text,datetime,score,subreddit,redditor,type,title,text_lemmatised,valence,arousal,dominance
0,"In college I met a girl at a house party. We drank and talked. Drank and talked. Drank and talked. Starting kissing. Tongues and all. 

She asked me to the restroom with her. Of course, I said. She took me by the hand and led me away.  I went in first and she shut the door behind her and locked it. 

I was certain things were about to go to the next level. She said hang on and unzipped her pants. Sat down on the toilet. 

I thought she had to pee. Then she grunted. I heard a fart. Then a plop. 

I unlocked the door and ran. Never saw her again.",2023-09-30 00:25:52,37468,stories,CardiffGiant1212,submission,I thought she took me to the restroom to have sex. I was wrong.,"['college', 'met', 'girl', 'house', 'party', 'drank', 'talked', 'drank', 'talked', 'drank', 'talked', 'starting', 'kissing', 'tongue', 'asked', 'restroom', 'course', 'said', 'took', 'hand', 'led', 'away', 'went', 'first', 'shut', 'door', 'behind', 'locked', 'certain', 'thing', 'go', 'next', 'level', 'said', 'hang', 'unzipped', 'pant', 'sat', 'toilet', 'thought', 'pee', 'grunted', 'heard', 'fart', 'plop', 'unlocked', 'door', 'ran', 'never', 'saw']",0.6197429906784926,0.4967302744584411,0.611575802848211
1,"Well, a couple of weeks ago I found out that my wife cheated on me 6 years ago, the way I found out is that her sister told me after going to visit her to find out how the delivery of her first child was, she confessed to me that 6 years ago my wife told her that she slept drunk with her best friend, in her words, my wife was very sorry.

&#x200B;

At the time she told me I was with my ""son"" and immediately after leaving her house I went to take a paternity test with him, fearing the worst.

&#x200B;

A week later I get the results and my fears came true, my son is not mine, for some reason, I began to see the boy differently, more as an acquaintance than a son, with proofs in hand I confronted my wife at night when the child was sleeping, she asked me who told me and I simply told her that it is none of her business, although obviously it will not take long to connect the dots that it was her sister, well, that is not my problem now.

&#x200B;

Regardless of that, I asked her for a divorce, which is now in process, she was ""devastated"", she swore to me more than once that nothing happened with anyone again, that she has been faithful to me in body and soul since then, I held back the urge to insult her to avoid complications during the divorce issue, not believing a word she said, mostly blaming the alcohol instead of taking the blame herself.

&#x200B;

After talking about it, she threatened me saying that she would demand full custody of the child, I was so annoyed at that moment that I told her okay, I don't want anything to do with something that is not mine, that she keep the child and I'll keep the dogs (we have two dogs that we adopted as puppies and they are currently 8 years old each) after my words she tried to convince me to take care of the child with her, that I am his father, at that moment I exploded, I was so angry and I had held back so much the urge to scream that I just yelled her to go and take her bastard with her.

&#x200B;

A week has passed since that and I am at home (it is in my name because it is a gift from my parents), she went to her parents' house with her kid, she has not called me since then, she left with everything and the half-asleep kid when I yelled at her, especially since it was the first time I really yelled at her, it sure affected her.

&#x200B;

I talked to my parents and my dad told me that I did the right thing and that I shouldn't be raising something that is not of my blood, and I agree with him, however, the pain is still there, my younger brother told me to write here to entertain myself, I am currently seeing a therapist 3 times a week, who told me that I have already taken the first step, which was to leave behind what causes me pain, it just hurts to know that my family no longer exists.

&#x200B;

Regarding why my sister-in-law told me everything, according to her, she felt guilty seeing me always happy with my son, knowing that he may not be mine, and that the fact that we went to visit her in a moment of weakness caused her to completely break down with guilt, I don't know how true that is, I just know that right now I feel tremendous hatred for my wife and a feeling between pain and resentment for the child, although it's just time to get ahead.

&#x200B;

I just hope the divorce goes smoothly, we have separate financers and properties and if she really asks for child support I have proof that it's not mine, according to my lawyer that's more than enough if she tries a legal process for that, my therapist also recommended that I not see him nor her, that regardless of the child's feelings, I should focus on my own first, that the child is no longer my problem and the sooner I accept it, the better.

&#x200B;

Sorry for the misspellings, English is not my first language.",2023-08-23 05:12:17,15814,stories,OkDot3924,submission,I(32M) am divorcing my wife (33F) after finding out that my son(5M) is not mine.,"['well', 'couple', 'week', 'ago', 'found', 'wife', 'cheated', '6', 'year', 'ago', 'way', 'found', 'sister', 'told', 'going', 'visit', 'find', 'delivery', 'first', 'child', 'confessed', '6', 'year', 'ago', 'wife', 'told', 'slept', 'drunk', 'best', 'friend', 'word', 'wife', 'sorry', 'x200b', 'time', 'told', '``', 'son', ""''"", 'immediately', 'leaving', 'house', 'went', 'take', 'paternity', 'test', 'fearing', 'worst', 'x200b', 'week', 'later', 'get', 'result', 'fear', 'came', 'true', 'son', 'mine', 'reason', 'began', 'see', 'boy', 'differently', 'acquaintance', 'son', 'proof', 'hand', 'confronted', 'wife', 'night', 'child', 'sleeping', 'asked', 'told', 'simply', 'told', 'none', 'business', 'although', 'obviously', 'take', 'long', 'connect', 'dot', 'sister', 'well', 'problem', 'x200b', 'regardless', 'asked', 'divorce', 'process', '``', 'devastated', ""''"", 'swore', 'nothing', 'happened', 'anyone', 'faithful', 'body', 'soul', 'since', 'held', 'back', 'urge', 'insult', 'avoid', 'complication', 'divorce', 'issue', 'believing', 'word', 'said', 'mostly', 'blaming', 'alcohol', 'instead', 'taking', 'blame', 'x200b', 'talking', 'threatened', 'saying', 'would', 'demand', 'full', 'custody', 'child', 'annoyed', 'moment', 'told', 'okay', ""n't"", 'want', 'anything', 'something', 'mine', 'keep', 'child', ""'ll"", 'keep', 'dog', 'two', 'dog', 'adopted', 'puppy', 'currently', '8', 'year', 'old', 'word', 'tried', 'convince', 'take', 'care', 'child', 'father', 'moment', 'exploded', 'angry', 'held', 'back', 'much', 'urge', 'scream', 'yelled', 'go', 'take', 'bastard', 'x200b', 'week', 'passed', 'since', 'home', 'name', 'gift', 'parent', 'went', 'parent', 'house', 'kid', 'called', 'since', 'left', 'everything', 'half-asleep', 'kid', 'yelled', 'especially', 'since', 'first', 'time', 'really', 'yelled', 'sure', 'affected', 'x200b', 'talked', 'parent', 'dad', 'told', 'right', 'thing', ""n't"", 'raising', 'something', 'blood', 'agree', 'however', 'pain', 'still', 'younger', 'brother', 'told', 'write', 'entertain', 'currently', 'seeing', 'therapist', '3', 'time', 'week', 'told', 'already', 'taken', 'first', 'step', 'leave', 'behind', 'cause', 'pain', 'hurt', 'know', 'family', 'longer', 'exists', 'x200b', 'regarding', 'sister-in-law', 'told', 'everything', 'according', 'felt', 'guilty', 'seeing', 'always', 'happy', 'son', 'knowing', 'may', 'mine', 'fact', 'went', 'visit', 'moment', 'weakness', 'caused', 'completely', 'break', 'guilt', ""n't"", 'know', 'true', 'know', 'right', 'feel', 'tremendous', 'hatred', 'wife', 'feeling', 'pain', 'resentment', 'child', 'although', ""'s"", 'time', 'get', 'ahead', 'x200b', 'hope', 'divorce', 'go', 'smoothly', 'separate', 'financers', 'property', 'really', 'asks', 'child', 'support', 'proof', ""'s"", 'mine', 'according', 'lawyer', ""'s"", 'enough', 'try', 'legal', 'process', 'therapist', 'also', 'recommended', 'see', 'regardless', 'child', ""'s"", 'feeling', 'focus', 'first', 'child', 'longer', 'problem', 'sooner', 'accept', 'better', 'x200b', 'sorry', 'misspelling', 'english', 'first', 'language']",0.5935269868625417,0.5104370477404865,0.558511797835909
2,"My 28 year old sister gave birth to her first daughter 2 weeks ago. I 17f was in the hospital together with my parents and her husband. The birth went pretty smooth, although she was screaming so loud.. I was so excited to be an auntie and holding my newborn niece in my arms was a precious moment. 

Everything seemed fine afterwards . My sister came home about 3 days later and she and her husband stayed with me and my parents as they needed help to take care of the baby. But 2 days after she came home, she was experiencing exhaustion, pain in her body, and she constantly fainting.
She kept insisting that she was fine but our mother said that fainting is not ""fine"" and brought her back to the hospital, where they discovered an infection or internal bleeding or both somewhere in her body and they were unable to treat it in time despite giving her mounds of antibiotics before she passed away 2 days later. 

A week has passed since, and 3 days since the funeral. I can't stop crying and thinking that if the doctors had noticed that something was wrong, my sister could still be alive. 

I loved my sister to death. She was my role model growing up. Now I lost her forever and only have my niece, who is completely unaware of what's going on. I'm sad, and angry, and upset and I miss my big sister so freaking much... I can't talk about this with my friends and she was my only sibling. My parents aren't helping much as they're also grieving, so I don't know what I'm expecting to get from here but I'm just a complete freaking wreck.",2023-08-25 16:44:06,14396,stories,dearSisterLove,submission,My sister died during post-partum and I'm a complete wreck.,"['28', 'year', 'old', 'sister', 'gave', 'birth', 'first', 'daughter', '2', 'week', 'ago', '17f', 'hospital', 'together', 'parent', 'husband', 'birth', 'went', 'pretty', 'smooth', 'although', 'screaming', 'loud', '..', 'excited', 'auntie', 'holding', 'newborn', 'niece', 'arm', 'precious', 'moment', 'everything', 'seemed', 'fine', 'afterwards', 'sister', 'came', 'home', '3', 'day', 'later', 'husband', 'stayed', 'parent', 'needed', 'help', 'take', 'care', 'baby', '2', 'day', 'came', 'home', 'experiencing', 'exhaustion', 'pain', 'body', 'constantly', 'fainting', 'kept', 'insisting', 'fine', 'mother', 'said', 'fainting', '``', 'fine', ""''"", 'brought', 'back', 'hospital', 'discovered', 'infection', 'internal', 'bleeding', 'somewhere', 'body', 'unable', 'treat', 'time', 'despite', 'giving', 'mound', 'antibiotic', 'passed', 'away', '2', 'day', 'later', 'week', 'passed', 'since', '3', 'day', 'since', 'funeral', 'ca', ""n't"", 'stop', 'cry', 'thinking', 'doctor', 'noticed', 'something', 'wrong', 'sister', 'could', 'still', 'alive', 'loved', 'sister', 'death', 'role', 'model', 'growing', 'lost', 'forever', 'niece', 'completely', 'unaware', ""'s"", 'going', ""'m"", 'sad', 'angry', 'upset', 'miss', 'big', 'sister', 'freaking', 'much', '...', 'ca', ""n't"", 'talk', 'friend', 'sibling', 'parent', ""n't"", 'helping', 'much', ""'re"", 'also', 'grieving', ""n't"", 'know', ""'m"", 'expecting', 'get', ""'m"", 'complete', 'freaking', 'wreck']",0.579822889821487,0.5091525514715105,0.529867593968919
3,"me and my girlfriend,(both 26) have been dating for three years now. my girlfriend is a huge Taylor swift fan and was really excited when she found out taylor would be performing at met life stadium, right near us. I decided to surprise her with taylor swift concert tickets, since i knew she really wanted to go. I called in sick the day the tickets dropped and waited in the ticket master cue for 2 hours. finally when it opened up, i bought two seats, for 400 dollars each, presumably one for her, and another for me. When she came back from work that night i surprised her with the tickets, and she was ecstatic. However, when I claimed i was excited to go with her, she got very confused and claimed she thought the two tickets were for her and her best friend, (who is also a big Taylor swift fan). I was very disappointed since I believed that this was an experience we could do together and it would be something we would remember for the rest of our lives. My girlfriend could tell I was upset and said she would be happy to go with me instead. I told her she should go with whoever she wanted to go with more, and to not go with me just because it was what i had planned. After hearing this my girlfriend immediately called her friend and told her that they were going to the taylor swift concert together (ouch). I told my girlfriend that if her friend wanted to go with her she had to pay the 400 dollars for the ticket and her friend agreed to. While my girlfriend and her friend went together and both had a great time I felt betrayed since she chose her over me. While i know my girlfriend’s bff is a much bigger taylor swift fan than me, i was still excited to go since i’ve never been to a concert before, and i like to listen to some of taylor swifts songs. Like i said before i also believed this would be a memory we could both remember together. Should I have done things differently and not given up my ticket so willingly?",2023-08-16 09:54:26,12598,stories,Then-Tale3612,submission,"I surprised my girlfriend with Taylor swift tickets, she wanted to bring her friend instead","['girlfriend', '26', 'dating', 'three', 'year', 'girlfriend', 'huge', 'taylor', 'swift', 'fan', 'really', 'excited', 'found', 'taylor', 'would', 'performing', 'met', 'life', 'stadium', 'right', 'near', 'u', 'decided', 'surprise', 'taylor', 'swift', 'concert', 'ticket', 'since', 'knew', 'really', 'wanted', 'go', 'called', 'sick', 'day', 'ticket', 'dropped', 'waited', 'ticket', 'master', 'cue', '2', 'hour', 'finally', 'opened', 'bought', 'two', 'seat', '400', 'dollar', 'presumably', 'one', 'another', 'came', 'back', 'work', 'night', 'surprised', 'ticket', 'ecstatic', 'however', 'claimed', 'excited', 'go', 'got', 'confused', 'claimed', 'thought', 'two', 'ticket', 'best', 'friend', 'also', 'big', 'taylor', 'swift', 'fan', 'disappointed', 'since', 'believed', 'experience', 'could', 'together', 'would', 'something', 'would', 'remember', 'rest', 'life', 'girlfriend', 'could', 'tell', 'upset', 'said', 'would', 'happy', 'go', 'instead', 'told', 'go', 'whoever', 'wanted', 'go', 'go', 'planned', 'hearing', 'girlfriend', 'immediately', 'called', 'friend', 'told', 'going', 'taylor', 'swift', 'concert', 'together', 'ouch', 'told', 'girlfriend', 'friend', 'wanted', 'go', 'pay', '400', 'dollar', 'ticket', 'friend', 'agreed', 'girlfriend', 'friend', 'went', 'together', 'great', 'time', 'felt', 'betrayed', 'since', 'chose', 'know', 'girlfriend', '’', 'bff', 'much', 'bigger', 'taylor', 'swift', 'fan', 'still', 'excited', 'go', 'since', '’', 'never', 'concert', 'like', 'listen', 'taylor', 'swift', 'song', 'like', 'said', 'also', 'believed', 'would', 'memory', 'could', 'remember', 'together', 'done', 'thing', 'differently', 'given', 'ticket', 'willingly']",0.6765031005064388,0.5320781026622368,0.6102637970464082
4,"WARNING! don't read this if you have any problems with feces and that kind of shit (pun intended) 
Someone told me that I should share this embarrassing story so here we go. (Disclaimer, English isn't my first language, so I'm sorry for all the spelling/grammar mistakes)

Me [F18] had just gotten in a relationship with my new sweet boyfriend [M20]. 
A little info about me. I have a chronic stomach wound which pops up whenever I'm really stressed. 

The relationship was very new so we were both still quite shy, we had just gotten comfortable enough farting in front of each other tho, and often made a joke out of it. 
About a month into our relationship I had to go to the hospital with my stomach wound, I was there for a week and he was super supportive the whole time. 
When I finally got home from the hospital my body was so weak, I wasn't allowed to drink or eat anything the whole week because of the tests they had to make. Therefore my body had pretty much shut down, nothing had come in, so nothing came out. I got prescribed some laxatives that I took, never having taken them before I didn't know what to expect but it definitely wasn't this! 
We were laying in bed, I was on my side looking at my phone, and he was half sitting up in bed playing RuneScape on his laptop in front of me. I could feel a fart coming, so I looked up into his eyes with a smirk face expression and said: ""I'm shitting!"" 

I meant to say ""I'm farting"" but the words came out wrong.. and so did something else. The moment I said it, I let it all out, still with a smirk face expression looking him right in the eyes. You could hear a wet bubbly sound, and I instantly knew what had happened. My smile fated and my face turned to horror, my hand flew down to stop the flow but it was too late. Boyfriend jumped up and ran to the toilet to bring me paper, he helped me clean up while just laughing hysterically, I was so embarrassed that I couldn't even say anything. 

Later when we sat and talked he told me that it was the most intimidating thing he had ever experienced, the way I looked right into his eyes, he had never felt so dominated in his life. ""Like a monkey shitting in its hand and throwing it"". 
Needless to say we got very quickly comfortable with intimate things like that after this. 
Even tho we've broken up since then and it's been a few years, I'm to this day still just as embarrassed.",2023-09-10 14:07:01,11581,stories,missemusepigen,submission,"I ""accidentally"" shit the bed in front of my boyfriend","['warning', ""n't"", 'read', 'problem', 'feces', 'kind', 'shit', 'pun', 'intended', 'someone', 'told', 'share', 'embarrassing', 'story', 'go', 'disclaimer', 'english', ""n't"", 'first', 'language', ""'m"", 'sorry', 'spelling/grammar', 'mistake', 'f18', 'gotten', 'relationship', 'new', 'sweet', 'boyfriend', 'm20', 'little', 'info', 'chronic', 'stomach', 'wound', 'pop', 'whenever', ""'m"", 'really', 'stressed', 'relationship', 'new', 'still', 'quite', 'shy', 'gotten', 'comfortable', 'enough', 'farting', 'front', 'tho', 'often', 'made', 'joke', 'month', 'relationship', 'go', 'hospital', 'stomach', 'wound', 'week', 'super', 'supportive', 'whole', 'time', 'finally', 'got', 'home', 'hospital', 'body', 'weak', ""n't"", 'allowed', 'drink', 'eat', 'anything', 'whole', 'week', 'test', 'make', 'therefore', 'body', 'pretty', 'much', 'shut', 'nothing', 'come', 'nothing', 'came', 'got', 'prescribed', 'laxative', 'took', 'never', 'taken', ""n't"", 'know', 'expect', 'definitely', ""n't"", 'laying', 'bed', 'side', 'looking', 'phone', 'half', 'sitting', 'bed', 'playing', 'runescape', 'laptop', 'front', 'could', 'feel', 'fart', 'coming', 'looked', 'eye', 'smirk', 'face', 'expression', 'said', '``', ""'m"", 'shitting', ""''"", 'meant', 'say', '``', ""'m"", 'farting', ""''"", 'word', 'came', 'wrong', '..', 'something', 'else', 'moment', 'said', 'let', 'still', 'smirk', 'face', 'expression', 'looking', 'right', 'eye', 'could', 'hear', 'wet', 'bubbly', 'sound', 'instantly', 'knew', 'happened', 'smile', 'fated', 'face', 'turned', 'horror', 'hand', 'flew', 'stop', 'flow', 'late', 'boyfriend', 'jumped', 'ran', 'toilet', 'bring', 'paper', 'helped', 'clean', 'laughing', 'hysterically', 'embarrassed', 'could', ""n't"", 'even', 'say', 'anything', 'later', 'sat', 'talked', 'told', 'intimidating', 'thing', 'ever', 'experienced', 'way', 'looked', 'right', 'eye', 'never', 'felt', 'dominated', 'life', '``', 'like', 'monkey', 'shitting', 'hand', 'throwing', ""''"", 'needle', 'say', 'got', 'quickly', 'comfortable', 'intimate', 'thing', 'like', 'even', 'tho', ""'ve"", 'broken', 'since', ""'s"", 'year', ""'m"", 'day', 'still', 'embarrassed']",0.6114883397473658,0.5180450879015785,0.5935883723916279
5,"My(25m) girlfriend(26) confessed to cheating on me last night, so I told her I’ve been cheating the whole time we’ve been together.  I had my suspicions that she’s been cheating as she’s been staying out late and just acting strange in general.

 Well, when she made her big announcement I replied by saying I’ve been cheating on her for the entirety of our relationship, which isn’t true. I told her I’ve been sleeping with 1 other women consistently and this drove her absolutely insane - like I genuinely thought she was going to do someone rash, like slash my tires or something. But no, she just screamed at me and demanded to know who she was. She went on to say she only cheated once and she was completely inebriated when it happened as if that someone absolves her of any wrongdoing. The audacity. 

well anyways, I broke up with her and threw her out of my house. I then proceeded to invite the boys over for some bbq. All in all, it was a hilarious experience. I know it’s not a crazy story, but I thought it was funny enough to share.",2023-12-07 23:29:30,10885,stories,disheveledhalfwit,submission,My girlfriend confessed to cheating on me so I lied and told her I cheated on her,"['25m', 'girlfriend', '26', 'confessed', 'cheating', 'last', 'night', 'told', '’', 'cheating', 'whole', 'time', '’', 'together', 'suspicion', '’', 'cheating', '’', 'staying', 'late', 'acting', 'strange', 'general', 'well', 'made', 'big', 'announcement', 'replied', 'saying', '’', 'cheating', 'entirety', 'relationship', '’', 'true', 'told', '’', 'sleeping', '1', 'woman', 'consistently', 'drove', 'absolutely', 'insane', 'like', 'genuinely', 'thought', 'going', 'someone', 'rash', 'like', 'slash', 'tire', 'something', 'screamed', 'demanded', 'know', 'went', 'say', 'cheated', 'completely', 'inebriated', 'happened', 'someone', 'absolves', 'wrongdoing', 'audacity', 'well', 'anyways', 'broke', 'threw', 'house', 'proceeded', 'invite', 'boy', 'bbq', 'hilarious', 'experience', 'know', '’', 'crazy', 'story', 'thought', 'funny', 'enough', 'share']",0.6220326721357647,0.5227724666408131,0.6007281553374493
6,"When my daughter was 5 years old, and just starting kindergarten I would occasionally tell my daughter ""Just remember, no dating and no boyfriends until you turn 30 years old"".

Wishful thinking, I know.

I told her this her first day of kindergarten, and she replied ""okay daddy"".

Then I would tell her the same thing every once in a while.  Not too often to be annoying, but often enough that she knew my rule.

Then one day, later in the school year (it may even have been when she was in 1st grade) as I was getting ready to drop her off at school, once again I said to her ""remember now, no dating and no boyfriends until you turn 30 years old"".

This time she had a totally different reply.

She turned to me, and looked right at me with those eyes that she could use to get whatever she wanted from her dad, and said ""Well, if I get good grades all through school and college, can I start dating when I am 29""?

It took all the willpower I had to not smile and start laughing when she asked that. With a very serious look on my face, I showed her that I was taking a moment to consider what she had just asked.

Then I replied to her ""Hmmm.....Well okay, you've got a deal. If you get good grades all through school and college I will let you start dating at 29"".

She replied, ""okay daddy"", got out of the car, and bounced her way on into school for the day.

For those who are going to ask, yes she waited till she was 29 to start dating, because she always followed daddy's rules.

Just kidding.

She had her first boyfriend at around 13 years old, breaking her Daddy's heart.

&#x200B;",2023-10-26 02:29:16,10313,stories,itsathrowaway6877,submission,A quick story about my dating policy for my daughter.,"['daughter', '5', 'year', 'old', 'starting', 'kindergarten', 'would', 'occasionally', 'tell', 'daughter', '``', 'remember', 'dating', 'boyfriend', 'turn', '30', 'year', 'old', ""''"", 'wishful', 'thinking', 'know', 'told', 'first', 'day', 'kindergarten', 'replied', '``', 'okay', 'daddy', ""''"", 'would', 'tell', 'thing', 'every', 'often', 'annoying', 'often', 'enough', 'knew', 'rule', 'one', 'day', 'later', 'school', 'year', 'may', 'even', '1st', 'grade', 'getting', 'ready', 'drop', 'school', 'said', '``', 'remember', 'dating', 'boyfriend', 'turn', '30', 'year', 'old', ""''"", 'time', 'totally', 'different', 'reply', 'turned', 'looked', 'right', 'eye', 'could', 'use', 'get', 'whatever', 'wanted', 'dad', 'said', '``', 'well', 'get', 'good', 'grade', 'school', 'college', 'start', 'dating', '29', ""''"", 'took', 'willpower', 'smile', 'start', 'laughing', 'asked', 'serious', 'look', 'face', 'showed', 'taking', 'moment', 'consider', 'asked', 'replied', '``', 'hmmm', '.....', 'well', 'okay', ""'ve"", 'got', 'deal', 'get', 'good', 'grade', 'school', 'college', 'let', 'start', 'dating', '29', ""''"", 'replied', '``', 'okay', 'daddy', ""''"", 'got', 'car', 'bounced', 'way', 'school', 'day', 'going', 'ask', 'yes', 'waited', 'till', '29', 'start', 'dating', 'always', 'followed', 'daddy', ""'s"", 'rule', 'kidding', 'first', 'boyfriend', 'around', '13', 'year', 'old', 'breaking', 'daddy', ""'s"", 'heart', 'x200b']",0.6083743992137681,0.46324046058363316,0.6029130800942119
