,text,datetime,score,subreddit,redditor,type,title,text_lemmatised,valence,arousal,dominance
7,"Four days ago I was walking with a coworker on a break just to stretch our legs. We work in an office setting so like to get up every once in a while and get some fresh air. We walk in a half circle around the building. In the back there are stairs that we like to go down and then back up on our way back for exercise. It's two sets of 15 concrete steps.

It was a beautiful sunny day with blue skies. Near the top of the stairs we were in mid-conversation while heading down and all of a sudden I hear him go ""Oh god"" and trip and fall somehow. He rolled down and landed at the bottom in a heap, face first in the concrete. I just stared for a few seconds because it was so sudden. I ran to the bottom while asking if he's ok, but he didn't move or respond. I got close and realized there was blood coming from his head and face and his arms and legs were seized up and stiff when I tried to roll him over.

I freaked out but managed to call 911 while also texting another coworker friend of mine to come outside the office because our friend fell. 911 told me to roll him over and do CPR while they came, which I did.

The ambulance got there about 7 minutes after I called and took him to the hospital, but I'm 99% sure he was already dead when I was doing CPR

I feel really weird about it. Like sad, but also just strange. It's hard to put into words. It doesn't seem real. I will get flashes where I realize what happened and feel an intense tightness in my chest and the severity of it hits me. I keep imagining him laying at the bottom of the stairs face down, and also his torn up face when I was giving him CPR when he was already dead. It's also just really sad because he was one of my best friends at work. I've barely slept since Tuesday, and was full of adrenaline for a full day after it happened.

He was single with no kids or anything. Only has a brother and father who live in other states.

I don't really know why I'm writing all this but I just feel really strange and am wondering if anyone ever experienced something like this.

EDIT: Didn't expect this post to get so much traction. I appreciate all the advice and positive thoughts sent my way. It saddens me that many of you have similar experiences. I can't respond to every comment but I am reading every single one. Thank you!",2023-09-22 20:21:09,10136,stories,Sheeitsheeit,submission,Four days ago my coworker who's also my friend fell down the stairs and died in front of me,"['four', 'day', 'ago', 'walking', 'coworker', 'break', 'stretch', 'leg', 'work', 'office', 'setting', 'like', 'get', 'every', 'get', 'fresh', 'air', 'walk', 'half', 'circle', 'around', 'building', 'back', 'stair', 'like', 'go', 'back', 'way', 'back', 'exercise', ""'s"", 'two', 'set', '15', 'concrete', 'step', 'beautiful', 'sunny', 'day', 'blue', 'sky', 'near', 'top', 'stair', 'mid-conversation', 'heading', 'sudden', 'hear', 'go', '``', 'oh', 'god', ""''"", 'trip', 'fall', 'somehow', 'rolled', 'landed', 'bottom', 'heap', 'face', 'first', 'concrete', 'stared', 'second', 'sudden', 'ran', 'bottom', 'asking', ""'s"", 'ok', ""n't"", 'move', 'respond', 'got', 'close', 'realized', 'blood', 'coming', 'head', 'face', 'arm', 'leg', 'seized', 'stiff', 'tried', 'roll', 'freaked', 'managed', 'call', '911', 'also', 'texting', 'another', 'coworker', 'friend', 'mine', 'come', 'outside', 'office', 'friend', 'fell', '911', 'told', 'roll', 'cpr', 'came', 'ambulance', 'got', '7', 'minute', 'called', 'took', 'hospital', ""'m"", '99', 'sure', 'already', 'dead', 'cpr', 'feel', 'really', 'weird', 'like', 'sad', 'also', 'strange', ""'s"", 'hard', 'put', 'word', ""n't"", 'seem', 'real', 'get', 'flash', 'realize', 'happened', 'feel', 'intense', 'tightness', 'chest', 'severity', 'hit', 'keep', 'imagining', 'laying', 'bottom', 'stair', 'face', 'also', 'torn', 'face', 'giving', 'cpr', 'already', 'dead', ""'s"", 'also', 'really', 'sad', 'one', 'best', 'friend', 'work', ""'ve"", 'barely', 'slept', 'since', 'tuesday', 'full', 'adrenaline', 'full', 'day', 'happened', 'single', 'kid', 'anything', 'brother', 'father', 'live', 'state', ""n't"", 'really', 'know', ""'m"", 'writing', 'feel', 'really', 'strange', 'wondering', 'anyone', 'ever', 'experienced', 'something', 'like', 'edit', ""n't"", 'expect', 'post', 'get', 'much', 'traction', 'appreciate', 'advice', 'positive', 'thought', 'sent', 'way', 'saddens', 'many', 'similar', 'experience', 'ca', ""n't"", 'respond', 'every', 'comment', 'reading', 'every', 'single', 'one', 'thank']",0.6004203046575368,0.4839230072996323,0.5807542354497024
8,"Edit: Reading through the comments made me realize I screwed up the title.

It should probably be: My boyfriend made me realize I was bi

I(24f) thought I was a lesbian until I met my boyfriend(20m). My whole life until last year, I've only dated women, and I get grossed out thinking of myself with a guy. My boyfriend and I met at an event we both volunteered for, and we became friends. We got closer, and I started thinking about him more and more. When I realized that I developed feelings for him, it terrified me. My whole life, I'd thought I was a lesbian, and then I developed feelings for a guy. Everything I knew was wrong. I tried distancing myself from him in hopes the feelings would go away, but they didn't. I kept thinking about him, and I eventually gave in and asked him out. Once I convinced him that I wasn't joking, he accepted, and we started dating.

Dating him wasn't that different than dating a girl. The sex was so weird, but he was so accommodating. The first couple of times, he made sure I was comfortable and he was so careful and gentle. The thought of me with any other guy still grosses me out, but being with my boyfriend makes me feel warm and fuzzy inside. I have no idea why he's the only guy I like, but the year we've been together has been probably the best year of my life. He gets me, and he gives the best hugs. We live together, and he's an amazing roommate and an amazing boyfriend.

Edit: spelling ",2023-11-25 00:56:13,9477,stories,Suspicious-Group-418,submission,My boyfriend turned me bi,"['edit', 'reading', 'comment', 'made', 'realize', 'screwed', 'title', 'probably', 'boyfriend', 'made', 'realize', 'bi', '24f', 'thought', 'lesbian', 'met', 'boyfriend', '20m', 'whole', 'life', 'last', 'year', ""'ve"", 'dated', 'woman', 'get', 'grossed', 'thinking', 'guy', 'boyfriend', 'met', 'event', 'volunteered', 'became', 'friend', 'got', 'closer', 'started', 'thinking', 'realized', 'developed', 'feeling', 'terrified', 'whole', 'life', ""'d"", 'thought', 'lesbian', 'developed', 'feeling', 'guy', 'everything', 'knew', 'wrong', 'tried', 'distancing', 'hope', 'feeling', 'would', 'go', 'away', ""n't"", 'kept', 'thinking', 'eventually', 'gave', 'asked', 'convinced', ""n't"", 'joking', 'accepted', 'started', 'dating', 'dating', ""n't"", 'different', 'dating', 'girl', 'sex', 'weird', 'accommodating', 'first', 'couple', 'time', 'made', 'sure', 'comfortable', 'careful', 'gentle', 'thought', 'guy', 'still', 'gross', 'boyfriend', 'make', 'feel', 'warm', 'fuzzy', 'inside', 'idea', ""'s"", 'guy', 'like', 'year', ""'ve"", 'together', 'probably', 'best', 'year', 'life', 'get', 'give', 'best', 'hug', 'live', 'together', ""'s"", 'amazing', 'roommate', 'amazing', 'boyfriend', 'edit', 'spelling']",0.643909557138734,0.5265802883921815,0.6364343143283249
9,"Hi, I'm a 35 year old woman married to a 45 year old man for over 7 years. We have 4 beautiful kids. My husband recently had his birthday this week. I surprised him with a pregnancy test result that we will be having a 5th child. He seemed to have a meltdown when he heard it and he said no, it is impossible, we have been careful. I thought he would be happy as he said it himself when we were dating that he wants a lot of kids. I calmed him down somehow... Yesterday, I went with my husband to the gynecologist to have my sonogram and the doctor says I am 10 weeks pregnant and we are having twins. My husband was livid. He keeps screaming no no no no no. I lost count of him saying no. After his meltdown at doctors office he told me that he just can't have 6 kids at his age. I got confused as what he is saying- as I know he wanted a big family. he wanted it himself. I cried and told him what are we supposed to do and he keep saying that he just can't have 6 kids. On our way home he says how he should not have gotten married and have kids and he does not know anymore if his life is worth it, that he'd be happy to have a reset button. I got so mad I told him that it takes two to tango, that creating a kid is not just my fault. Today I woke up with screaming and crying kids begging their father to not go. Turns out he already packed and ready to go. My 3 year old is hugging his fathers luggage and crying and his face is stoic. By then I knew I was stupid to committing a mistake of marrying him. It maybe hard as I am pregnant right now, but I got a full time job and we do have a nanny and supportive family and friends. It is best if he go, I do not need another baby to take care of. So, to my dear soon to be ex-husband Jerry, F\*CK YOU. don't come back.

&#x200B;",2023-08-03 10:50:11,9377,stories,Witty-Firefighter-28,submission,Husband wants to reset his whole life.,"['hi', ""'m"", '35', 'year', 'old', 'woman', 'married', '45', 'year', 'old', 'man', '7', 'year', '4', 'beautiful', 'kid', 'husband', 'recently', 'birthday', 'week', 'surprised', 'pregnancy', 'test', 'result', '5th', 'child', 'seemed', 'meltdown', 'heard', 'said', 'impossible', 'careful', 'thought', 'would', 'happy', 'said', 'dating', 'want', 'lot', 'kid', 'calmed', 'somehow', '...', 'yesterday', 'went', 'husband', 'gynecologist', 'sonogram', 'doctor', 'say', '10', 'week', 'pregnant', 'twin', 'husband', 'livid', 'keep', 'screaming', 'lost', 'count', 'saying', 'meltdown', 'doctor', 'office', 'told', 'ca', ""n't"", '6', 'kid', 'age', 'got', 'confused', 'saying-', 'know', 'wanted', 'big', 'family', 'wanted', 'cried', 'told', 'supposed', 'keep', 'saying', 'ca', ""n't"", '6', 'kid', 'way', 'home', 'say', 'gotten', 'married', 'kid', 'know', 'anymore', 'life', 'worth', ""'d"", 'happy', 'reset', 'button', 'got', 'mad', 'told', 'take', 'two', 'tango', 'creating', 'kid', 'fault', 'today', 'woke', 'screaming', 'cry', 'kid', 'begging', 'father', 'go', 'turn', 'already', 'packed', 'ready', 'go', '3', 'year', 'old', 'hugging', 'father', 'luggage', 'cry', 'face', 'stoic', 'knew', 'stupid', 'committing', 'mistake', 'marrying', 'maybe', 'hard', 'pregnant', 'right', 'got', 'full', 'time', 'job', 'nanny', 'supportive', 'family', 'friend', 'best', 'go', 'need', 'another', 'baby', 'take', 'care', 'dear', 'soon', 'ex-husband', 'jerry', 'f\\', 'ck', ""n't"", 'come', 'back', 'x200b']",0.6006971884582685,0.5005617200740383,0.5519552586261
